{
  "$schema": "https://json-schema.org/draft/2020-12/schema",
  "title": "Command",
  "type": "object",
  "properties": {
    "schema_version": {
      "const": "1.0"
    },
    "request_id": {
      "description": "Caller-supplied IDs must be nonblank and at most 256 UTF-8 bytes, checked by Core. Internal composite receipt IDs append a colon and step index after input validation and may exceed that caller limit; they are not new standalone requests.",
      "type": "string",
      "minLength": 1
    },
    "device_id": {
      "type": "string",
      "minLength": 1
    },
    "component_id": {
      "type": "string",
      "minLength": 1
    },
    "capability": {
      "type": "string",
      "minLength": 1
    },
    "action": {
      "type": "string",
      "minLength": 1
    },
    "arguments": {
      "type": "object",
      "description": "Must satisfy the selected device action schema and one complete trusted grant. Commands cannot supply or expand grants."
    },
    "connection": {
      "enum": [
        "auto",
        "lan",
        "cloud"
      ],
      "description": "Requested route policy; it never grants authority. Core intersects it with trusted component/argument/route grants and action support."
    },
    "timeout_ms": {
      "type": "integer",
      "minimum": 1,
      "maximum": 180000
    },
    "wait_for": {
      "enum": [
        "accepted",
        "verified"
      ]
    }
  },
  "required": [
    "schema_version",
    "request_id",
    "device_id",
    "component_id",
    "capability",
    "action",
    "arguments",
    "connection",
    "timeout_ms",
    "wait_for"
  ],
  "additionalProperties": false
}
