{
  "schema_version": "1.0",
  "request_id": "req-example-001",
  "device_id": "dev-example-ac",
  "component_id": "main",
  "capability": "climate",
  "action": "set",
  "arguments": {
    "target_temperature": 26,
    "mode": "cool"
  },
  "connection": "auto",
  "timeout_ms": 10000,
  "wait_for": "verified"
}
