{
  "schema_version": "1.0",
  "request_id": "dishwasher-start-1",
  "device_id": "30000000-0000-4000-8000-000000000001",
  "component_id": "main",
  "capability": "vendor.midea.dishwasher",
  "action": "start_cycle",
  "arguments": {
    "program": "eco_wash",
    "additional": 0
  },
  "connection": "cloud",
  "timeout_ms": 10000,
  "wait_for": "verified"
}
