{
  "schema_version": "1.0",
  "request_id": "fictional-meiju-mode",
  "device_id": "30000000-0000-4000-8000-000000000001",
  "component_id": "main",
  "capability": "vendor.midea.ac",
  "action": "activate_mode",
  "arguments": {
    "mode": "cool"
  },
  "connection": "cloud",
  "timeout_ms": 10000,
  "wait_for": "verified"
}
