{
  "schema_version": "1.0",
  "request_id": "fictional-temperature-1",
  "device_id": "30000000-0000-4000-8000-000000000001",
  "component_id": "main",
  "capability": "climate",
  "action": "set",
  "arguments": {
    "target_temperature": 26.5
  },
  "connection": "cloud",
  "timeout_ms": 10000,
  "wait_for": "verified"
}
